{
  "$schema": "https://json-schema.org/draft/2020-12/schema",
  "$id": "https://tale-ui.dev/schemas/conformance.schema.json",
  "title": "Cross-platform token conformance report",
  "type": "object",
  "additionalProperties": false,
  "required": [
    "schemaVersion",
    "sourceDigest",
    "platform",
    "appearance",
    "highContrast",
    "matched",
    "exceptions"
  ],
  "properties": {
    "schemaVersion": { "const": "1.0.0" },
    "sourceDigest": { "type": "string", "pattern": "^sha256:[a-f0-9]{64}$" },
    "platform": { "enum": ["web", "react-native"] },
    "appearance": { "enum": ["light", "dark"] },
    "highContrast": { "enum": ["supported", "guided", "not-applicable"] },
    "matched": { "type": "array", "items": { "type": "string" } },
    "unmatched": { "type": "array", "items": { "type": "string" } },
    "exceptions": {
      "type": "array",
      "items": {
        "type": "object",
        "additionalProperties": false,
        "required": [
          "tokenPattern",
          "unsupportedBehavior",
          "fallback",
          "evidence",
          "owner",
          "reviewBy",
          "expiresOn"
        ],
        "properties": {
          "tokenPattern": { "type": "string" },
          "unsupportedBehavior": { "type": "string" },
          "fallback": { "type": "string" },
          "evidence": { "type": "string" },
          "owner": { "type": "string" },
          "reviewBy": { "type": "string", "format": "date" },
          "expiresOn": { "type": "string", "format": "date" }
        }
      }
    }
  }
}
