{
  "schemaVersion": "1.0.0",
  "sourceDigest": "sha256:83b72fc79b34932ae1afa44d21f74460a23fa693407bc319fdfafb3a2bb64a86",
  "platform": "react-native",
  "appearance": "light",
  "highContrast": "guided",
  "matched": [
    "--amber",
    "--amber-10",
    "--amber-100",
    "--amber-20",
    "--amber-30",
    "--amber-40",
    "--amber-5",
    "--amber-50",
    "--amber-60",
    "--amber-70",
    "--amber-80",
    "--amber-90",
    "--background",
    "--bg-body",
    "--body-font",
    "--brand-10",
    "--brand-100",
    "--brand-20",
    "--brand-30",
    "--brand-40",
    "--brand-5",
    "--brand-50",
    "--brand-60",
    "--brand-70",
    "--brand-80",
    "--brand-90",
    "--color-10",
    "--color-10-fg",
    "--color-100",
    "--color-100-fg",
    "--color-20",
    "--color-20-fg",
    "--color-30",
    "--color-30-fg",
    "--color-40",
    "--color-40-fg",
    "--color-5",
    "--color-5-fg",
    "--color-50",
    "--color-50-fg",
    "--color-60",
    "--color-60-fg",
    "--color-70",
    "--color-70-fg",
    "--color-80",
    "--color-80-fg",
    "--color-90",
    "--color-90-fg",
    "--cyan",
    "--cyan-10",
    "--cyan-100",
    "--cyan-20",
    "--cyan-30",
    "--cyan-40",
    "--cyan-5",
    "--cyan-50",
    "--cyan-60",
    "--cyan-70",
    "--cyan-80",
    "--cyan-90",
    "--display-color",
    "--display-default-color",
    "--display-font",
    "--display-font-family",
    "--display-font-weight",
    "--display-l-font-size",
    "--display-line-height",
    "--display-m-font-size",
    "--display-s-font-size",
    "--emerald",
    "--emerald-10",
    "--emerald-100",
    "--emerald-20",
    "--emerald-30",
    "--emerald-40",
    "--emerald-5",
    "--emerald-50",
    "--emerald-60",
    "--emerald-70",
    "--emerald-80",
    "--emerald-90",
    "--error",
    "--error-10",
    "--error-10-fg",
    "--error-100",
    "--error-100-fg",
    "--error-20",
    "--error-20-fg",
    "--error-30",
    "--error-30-fg",
    "--error-40",
    "--error-40-fg",
    "--error-5",
    "--error-5-fg",
    "--error-50",
    "--error-50-fg",
    "--error-60",
    "--error-60-fg",
    "--error-70",
    "--error-70-fg",
    "--error-80",
    "--error-80-fg",
    "--error-90",
    "--error-90-fg",
    "--expressive-font",
    "--expressive-font-family",
    "--fuchsia",
    "--fuchsia-10",
    "--fuchsia-100",
    "--fuchsia-20",
    "--fuchsia-30",
    "--fuchsia-40",
    "--fuchsia-5",
    "--fuchsia-50",
    "--fuchsia-60",
    "--fuchsia-70",
    "--fuchsia-80",
    "--fuchsia-90",
    "--green",
    "--green-10",
    "--green-100",
    "--green-20",
    "--green-30",
    "--green-40",
    "--green-5",
    "--green-50",
    "--green-60",
    "--green-70",
    "--green-80",
    "--green-90",
    "--heading-font-family",
    "--heading-font-weight",
    "--heading-l-font-size",
    "--heading-line-height",
    "--heading-m-font-size",
    "--heading-s-font-size",
    "--indigo",
    "--indigo-10",
    "--indigo-100",
    "--indigo-20",
    "--indigo-30",
    "--indigo-40",
    "--indigo-5",
    "--indigo-50",
    "--indigo-60",
    "--indigo-70",
    "--indigo-80",
    "--indigo-90",
    "--label-font-family",
    "--label-font-weight",
    "--label-l-font-size",
    "--label-line-height",
    "--label-m-font-size",
    "--label-s-font-size",
    "--label-xs-font-size",
    "--lime",
    "--lime-10",
    "--lime-100",
    "--lime-20",
    "--lime-30",
    "--lime-40",
    "--lime-5",
    "--lime-50",
    "--lime-60",
    "--lime-70",
    "--lime-80",
    "--lime-90",
    "--max-screen-width",
    "--min-screen-width",
    "--mono-color",
    "--mono-default-color",
    "--mono-font",
    "--mono-font-family",
    "--mono-font-weight",
    "--mono-l-font-size",
    "--mono-line-height",
    "--mono-m-font-size",
    "--mono-s-font-size",
    "--mono-xs-font-size",
    "--motion-content-duration",
    "--motion-duration-deliberate",
    "--motion-duration-fast",
    "--motion-duration-instant",
    "--motion-duration-moderate",
    "--motion-duration-quick",
    "--motion-duration-slow",
    "--motion-enter-duration",
    "--motion-exit-duration",
    "--motion-feedback-duration",
    "--motion-state-duration",
    "--neutral-10",
    "--neutral-10-fg",
    "--neutral-100",
    "--neutral-100-fg",
    "--neutral-12",
    "--neutral-12-fg",
    "--neutral-14",
    "--neutral-14-fg",
    "--neutral-16",
    "--neutral-16-fg",
    "--neutral-18",
    "--neutral-18-fg",
    "--neutral-20",
    "--neutral-20-fg",
    "--neutral-22",
    "--neutral-22-fg",
    "--neutral-24",
    "--neutral-24-fg",
    "--neutral-26",
    "--neutral-26-fg",
    "--neutral-28",
    "--neutral-28-fg",
    "--neutral-30",
    "--neutral-30-fg",
    "--neutral-40",
    "--neutral-40-fg",
    "--neutral-5",
    "--neutral-5-fg",
    "--neutral-50",
    "--neutral-50-fg",
    "--neutral-60",
    "--neutral-60-fg",
    "--neutral-70",
    "--neutral-70-fg",
    "--neutral-80",
    "--neutral-80-fg",
    "--neutral-82",
    "--neutral-82-fg",
    "--neutral-84",
    "--neutral-84-fg",
    "--neutral-86",
    "--neutral-86-fg",
    "--neutral-88",
    "--neutral-88-fg",
    "--neutral-90",
    "--neutral-90-fg",
    "--neutral-92",
    "--neutral-92-fg",
    "--neutral-94",
    "--neutral-94-fg",
    "--neutral-96",
    "--neutral-96-fg",
    "--neutral-98",
    "--neutral-98-fg",
    "--neutral-cool-10",
    "--neutral-cool-100",
    "--neutral-cool-12",
    "--neutral-cool-14",
    "--neutral-cool-16",
    "--neutral-cool-18",
    "--neutral-cool-20",
    "--neutral-cool-22",
    "--neutral-cool-24",
    "--neutral-cool-26",
    "--neutral-cool-28",
    "--neutral-cool-30",
    "--neutral-cool-40",
    "--neutral-cool-5",
    "--neutral-cool-50",
    "--neutral-cool-60",
    "--neutral-cool-70",
    "--neutral-cool-80",
    "--neutral-cool-82",
    "--neutral-cool-84",
    "--neutral-cool-86",
    "--neutral-cool-88",
    "--neutral-cool-90",
    "--neutral-cool-92",
    "--neutral-cool-94",
    "--neutral-cool-96",
    "--neutral-cool-98",
    "--neutral-default",
    "--neutral-default-10",
    "--neutral-default-100",
    "--neutral-default-12",
    "--neutral-default-14",
    "--neutral-default-16",
    "--neutral-default-18",
    "--neutral-default-20",
    "--neutral-default-22",
    "--neutral-default-24",
    "--neutral-default-26",
    "--neutral-default-28",
    "--neutral-default-30",
    "--neutral-default-40",
    "--neutral-default-5",
    "--neutral-default-50",
    "--neutral-default-60",
    "--neutral-default-70",
    "--neutral-default-80",
    "--neutral-default-82",
    "--neutral-default-84",
    "--neutral-default-86",
    "--neutral-default-88",
    "--neutral-default-90",
    "--neutral-default-92",
    "--neutral-default-94",
    "--neutral-default-96",
    "--neutral-default-98",
    "--neutral-gray-10",
    "--neutral-gray-100",
    "--neutral-gray-12",
    "--neutral-gray-14",
    "--neutral-gray-16",
    "--neutral-gray-18",
    "--neutral-gray-20",
    "--neutral-gray-22",
    "--neutral-gray-24",
    "--neutral-gray-26",
    "--neutral-gray-28",
    "--neutral-gray-30",
    "--neutral-gray-40",
    "--neutral-gray-5",
    "--neutral-gray-50",
    "--neutral-gray-60",
    "--neutral-gray-70",
    "--neutral-gray-80",
    "--neutral-gray-82",
    "--neutral-gray-84",
    "--neutral-gray-86",
    "--neutral-gray-88",
    "--neutral-gray-90",
    "--neutral-gray-92",
    "--neutral-gray-94",
    "--neutral-gray-96",
    "--neutral-gray-98",
    "--neutral-mono-10",
    "--neutral-mono-100",
    "--neutral-mono-12",
    "--neutral-mono-14",
    "--neutral-mono-16",
    "--neutral-mono-18",
    "--neutral-mono-20",
    "--neutral-mono-22",
    "--neutral-mono-24",
    "--neutral-mono-26",
    "--neutral-mono-28",
    "--neutral-mono-30",
    "--neutral-mono-40",
    "--neutral-mono-5",
    "--neutral-mono-50",
    "--neutral-mono-60",
    "--neutral-mono-70",
    "--neutral-mono-80",
    "--neutral-mono-82",
    "--neutral-mono-84",
    "--neutral-mono-86",
    "--neutral-mono-88",
    "--neutral-mono-90",
    "--neutral-mono-92",
    "--neutral-mono-94",
    "--neutral-mono-96",
    "--neutral-mono-98",
    "--neutral-onyx-10",
    "--neutral-onyx-100",
    "--neutral-onyx-12",
    "--neutral-onyx-14",
    "--neutral-onyx-16",
    "--neutral-onyx-18",
    "--neutral-onyx-20",
    "--neutral-onyx-22",
    "--neutral-onyx-24",
    "--neutral-onyx-26",
    "--neutral-onyx-28",
    "--neutral-onyx-30",
    "--neutral-onyx-40",
    "--neutral-onyx-5",
    "--neutral-onyx-50",
    "--neutral-onyx-60",
    "--neutral-onyx-70",
    "--neutral-onyx-80",
    "--neutral-onyx-82",
    "--neutral-onyx-84",
    "--neutral-onyx-86",
    "--neutral-onyx-88",
    "--neutral-onyx-90",
    "--neutral-onyx-92",
    "--neutral-onyx-94",
    "--neutral-onyx-96",
    "--neutral-onyx-98",
    "--neutral-slate-10",
    "--neutral-slate-100",
    "--neutral-slate-12",
    "--neutral-slate-14",
    "--neutral-slate-16",
    "--neutral-slate-18",
    "--neutral-slate-20",
    "--neutral-slate-22",
    "--neutral-slate-24",
    "--neutral-slate-26",
    "--neutral-slate-28",
    "--neutral-slate-30",
    "--neutral-slate-40",
    "--neutral-slate-5",
    "--neutral-slate-50",
    "--neutral-slate-60",
    "--neutral-slate-70",
    "--neutral-slate-80",
    "--neutral-slate-82",
    "--neutral-slate-84",
    "--neutral-slate-86",
    "--neutral-slate-88",
    "--neutral-slate-90",
    "--neutral-slate-92",
    "--neutral-slate-94",
    "--neutral-slate-96",
    "--neutral-slate-98",
    "--neutral-warm-10",
    "--neutral-warm-100",
    "--neutral-warm-12",
    "--neutral-warm-14",
    "--neutral-warm-16",
    "--neutral-warm-18",
    "--neutral-warm-20",
    "--neutral-warm-22",
    "--neutral-warm-24",
    "--neutral-warm-26",
    "--neutral-warm-28",
    "--neutral-warm-30",
    "--neutral-warm-40",
    "--neutral-warm-5",
    "--neutral-warm-50",
    "--neutral-warm-60",
    "--neutral-warm-70",
    "--neutral-warm-80",